tag,sentence
QUESTION:QUERY,What is the largest mammal in the ocean
QUESTION:QUERY,What is the largest mammal in the world
QUESTION:QUERY,What is the largest ocean in the world
QUESTION:QUERY,What is the largest ocean on Earth
QUESTION:QUERY,What is the largest planet in our solar system
QUESTION:QUERY,What is the largest reptile in the world
QUESTION:QUERY,What is the largest river by discharge
QUESTION:QUERY,What is the largest river by length
QUESTION:QUERY,What is the largest species of shark
QUESTION:QUERY,What is the largest volcano in the world
QUESTION:QUERY,What is the largest waterfall in the world
QUESTION:QUERY,What is the latest episode of "This American Life"
QUESTION:QUERY,What is the latest film featuring Angela White
QUESTION:QUERY,What is the latest firmware update for my smart thermostat
QUESTION:QUERY,What is the latest news
QUESTION:QUERY,What is the latest news about Adriana Chechik
QUESTION:QUERY,What is the latest news about adult film actress Janice Griffith
QUESTION:QUERY,What is the latest news on the project
QUESTION:QUERY,What is the latest release by Riley Reid
QUESTION:QUERY,What is the latest update on Jasmine Webb
QUESTION:QUERY,What is the length of the Nile River
QUESTION:QUERY,What is the length of the current audiobook chapter
QUESTION:QUERY,What is the longest mountain range in the world
QUESTION:QUERY,What is the longest river in Africa
QUESTION:QUERY,What is the longest river in Asia
QUESTION:QUERY,What is the longest river in Europe
QUESTION:QUERY,What is the longest river in South America
QUESTION:QUERY,What is the longest river in the world
QUESTION:QUERY,What is the longest-running Broadway musical
QUESTION:QUERY,What is the main ingredient in a Caesar salad
QUESTION:QUERY,What is the main ingredient in a margarita pizza
QUESTION:QUERY,What is the main ingredient in a traditional pizza
QUESTION:QUERY,What is the main ingredient in a traditional shepherd’s pie
QUESTION:QUERY,What is the main ingredient in guacamole
QUESTION:QUERY,What is the main ingredient in sushi
QUESTION:QUERY,What is the main language spoken in Argentina
QUESTION:QUERY,What is the main language spoken in India
QUESTION:QUERY,What is the main language spoken in Mexico
QUESTION:QUERY,What is the main purpose of the United Nations
QUESTION:QUERY,What is the main source of energy for the Earth
QUESTION:QUERY,What is the main source of energy for the Sun
QUESTION:QUERY,What is the main theme of "The History of Rome" podcast
QUESTION:QUERY,What is the meaning of "cliché" in French
QUESTION:QUERY,What is the meaning of "doppelgänger"
QUESTION:QUERY,What is the meaning of "oxymoron"
QUESTION:QUERY,What is the meaning of "panacea"
QUESTION:QUERY,What is the meaning of "pseudonym"
QUESTION:QUERY,What is the meaning of life
QUESTION:QUERY,What is the meaning of the idiom "a piece of cake"
QUESTION:QUERY,What is the meaning of the idiom "spill the beans"
QUESTION:QUERY,What is the meaning of the term "hyperbole"
QUESTION:QUERY,What is the meaning of the word "serendipity"
QUESTION:QUERY,What is the meaning of this word
QUESTION:QUERY,What is the most abundant element in the Earth’s crust
QUESTION:QUERY,What is the most abundant element in the universe
QUESTION:QUERY,What is the most abundant gas in the Earth's atmosphere
QUESTION:QUERY,What is the most common element in the universe
QUESTION:QUERY,What is the most common gas in the Earth's atmosphere
QUESTION:QUERY,What is the most common greeting in Mandarin
QUESTION:QUERY,What is the most common substance in the universe
QUESTION:QUERY,What is the most common verb tense in English
QUESTION:QUERY,What is the most common way to express gratitude in English
QUESTION:QUERY,What is the most common way to greet someone in French
QUESTION:QUERY,What is the most popular food in the world
QUESTION:QUERY,What is the most populous city in the United States
QUESTION:QUERY,What is the most populous city in the world
QUESTION:QUERY,What is the most spoken language in the world
QUESTION:QUERY,What is the most widely spoken language in the world
QUESTION:QUERY,What is the name of our galaxy
QUESTION:QUERY,What is the name of the first artificial Earth satellite
QUESTION:QUERY,What is the name of the first artificial satellite
QUESTION:QUERY,What is the name of the galaxy we live in
QUESTION:QUERY,What is the name of the largest moon of Saturn
QUESTION:QUERY,What is the name of the longest river in South America
QUESTION:QUERY,What is the name of this artist
QUESTION:QUERY,What is the name of this podcast episode
QUESTION:QUERY,What is the national animal of Canada
QUESTION:QUERY,What is the national flower of Japan
QUESTION:QUERY,What is the official language of Egypt
QUESTION:QUERY,What is the origin of the phrase "break the ice"
QUESTION:QUERY,What is the origin of the word "etymology"
QUESTION:QUERY,What is the origin of the word "quarantine"
QUESTION:QUERY,What is the origin of the word "sandwich"
QUESTION:QUERY,What is the origin of this artifact
QUESTION:QUERY,What is the past participle of the verb "to eat"
QUESTION:QUERY,What is the past tense of "to buy" in French
QUESTION:QUERY,What is the past tense of "to write" in Italian
QUESTION:QUERY,What is the past tense of the verb "go" in French
QUESTION:QUERY,What is the plot of "The Matrix"
QUESTION:QUERY,What is the plural of "alumnus"
QUESTION:QUERY,What is the plural of "cactus" in English
QUESTION:QUERY,What is the plural of "mouse" in English
QUESTION:QUERY,What is the pollen count today
QUESTION:QUERY,What is the population of India
QUESTION:QUERY,What is the population of New York City
QUESTION:QUERY,What is the price of this item
QUESTION:QUERY,What is the primary diet of a giraffe
QUESTION:QUERY,What is the primary diet of a koala
QUESTION:QUERY,What is the primary diet of a panda
QUESTION:QUERY,What is the primary diet of a polar bear
QUESTION:QUERY,What is the primary ingredient in a mojito
QUESTION:QUERY,What is the primary ingredient in hummus
QUESTION:QUERY,What is the primary ingredient in sushi
QUESTION:QUERY,What is the primary language spoken in Italy
QUESTION:QUERY,What is the primary purpose of the International Space Station
QUESTION:QUERY,What is the process by which plants make food
QUESTION:QUERY,What is the process by which plants make their food
QUESTION:QUERY,What is the professional background of Lana Rhoades
QUESTION:QUERY,What is the real name of the adult actress known as "Lana Rhoades"
QUESTION:QUERY,What is the recommended dosage of medication for my dog
QUESTION:QUERY,What is the release date of this audiobook
QUESTION:QUERY,What is the root of the word "telephone"
QUESTION:QUERY,What is the slowest animal in the world
QUESTION:QUERY,What is the smallest amphibian in the world
QUESTION:QUERY,What is the smallest animal in the world
QUESTION:QUERY,What is the smallest bird in the world
QUESTION:QUERY,What is the smallest bone in the human body
QUESTION:QUERY,What is the smallest bone in the human ear
QUESTION:QUERY,What is the smallest country in Africa
QUESTION:QUERY,What is the smallest country in the world
QUESTION:QUERY,What is the smallest fish in the world
QUESTION:QUERY,What is the smallest mammal in the world
QUESTION:QUERY,What is the smallest planet in our solar system
QUESTION:QUERY,What is the smallest planet in the solar system
QUESTION:QUERY,What is the smallest reptile in the world
QUESTION:QUERY,What is the speed of light
QUESTION:QUERY,What is the speed of light in a vacuum
QUESTION:QUERY,What is the speed of sound
QUESTION:QUERY,What is the status of my application
QUESTION:QUERY,What is the status of my home security system
QUESTION:QUERY,What is the status of the front door lock
QUESTION:QUERY,What is the status of the home security system
QUESTION:QUERY,What is the tallest animal in the world
QUESTION:QUERY,What is the tallest building in the United States
QUESTION:QUERY,What is the tallest building in the world
QUESTION:QUERY,What is the tallest mountain in the world
QUESTION:QUERY,What is the tallest waterfall in the world
QUESTION:QUERY,What is the temperature in the house
QUESTION:QUERY,What is the temperature now
QUESTION:QUERY,What is the temperature outside
QUESTION:QUERY,What is the time
QUESTION:QUERY,What is the time in Tokyo
QUESTION:QUERY,What is the title of the current audiobook
QUESTION:QUERY,What is the topic of the latest episode of "The Joe Rogan Experience"
QUESTION:QUERY,What is the verb form of "noun"
QUESTION:QUERY,What is the weather forecast for the next week
QUESTION:QUERY,What is the weather forecast for tomorrow
QUESTION:QUERY,What is the weather like
QUESTION:QUERY,What is the weather like in New York City
QUESTION:QUERY,What is the weather like today
QUESTION:QUERY,What is your name
QUESTION:QUERY,What kind of dog do you have
QUESTION:QUERY,What kind of music do you like
QUESTION:QUERY,What language is spoken in Brazil
QUESTION:QUERY,What languages can the voice assistant speak
QUESTION:QUERY,What languages can the voice assistant translate
QUESTION:QUERY,What methods are used to improve productivity
QUESTION:QUERY,What movies are trending this week
QUESTION:QUERY,What movies has Mia Khalifa appeared in
QUESTION:QUERY,What new podcasts are trending this week
QUESTION:QUERY,What new releases are out from Stormy Daniels
QUESTION:QUERY,What notable achievements does Tori Black have
QUESTION:QUERY,What other audiobooks are recommended for fans of this book
QUESTION:QUERY,What planet is known as the Red Planet
QUESTION:QUERY,What recent accomplishments has Mia Khalifa achieved
QUESTION:QUERY,What recent movies has Abella Danger appeared in
QUESTION:QUERY,What settings should I adjust to block adult websites
QUESTION:QUERY,What should I do if my dog has diarrhea
QUESTION:QUERY,What should I wear to the party
QUESTION:QUERY,What should we buy
QUESTION:QUERY,What song is currently playing
QUESTION:QUERY,What song is playing right now
QUESTION:QUERY,What steps are needed to complete the application
QUESTION:QUERY,What steps should I take next
QUESTION:QUERY,What temperature is the thermostat set to
QUESTION:QUERY,What time does the event start
QUESTION:QUERY,What time does the movie start
QUESTION:QUERY,What time does the security light turn on at night
QUESTION:QUERY,What time does the smart oven preheat
QUESTION:QUERY,What time does the smart sprinkler system activate
QUESTION:QUERY,What time does the sports match start
QUESTION:QUERY,What time does the store close today
QUESTION:QUERY,What time does the train arrive
QUESTION:QUERY,What time is it
QUESTION:QUERY,What time is my next appointment
QUESTION:QUERY,What time is my next meeting
QUESTION:QUERY,What time is the next bus arriving
QUESTION:QUERY,What time is the next vet appointment for my dog
QUESTION:QUERY,What time is the smart home alarm set for
QUESTION:QUERY,What time should I arrive for the appointment
QUESTION:QUERY,What time should I feed my pet today
QUESTION:QUERY,What time will the lights turn off automatically
QUESTION:QUERY,What time will the porch light turn on tonight
QUESTION:QUERY,What topics does "Stuff You Should Know" cover
QUESTION:QUERY,What vaccinations does my dog need
QUESTION:QUERY,What vaccines does my dog need
QUESTION:QUERY,What was she washing
QUESTION:QUERY,What will he buy
QUESTION:QUERY,What will the high temperature be today
QUESTION:QUERY,What year did World War II end
QUESTION:QUERY,What year did the Titanic sink
QUESTION:QUERY,What year was the Declaration of Independence signed
QUESTION:QUERY,What's he playing
QUESTION:QUERY,What’s new on Netflix this month
QUESTION:QUERY,What’s on my calendar for today
QUESTION:QUERY,What’s the average rating of this audiobook
QUESTION:QUERY,What’s the battery level of the smart thermostat
QUESTION:QUERY,What’s the best way to cook chicken
QUESTION:QUERY,What’s the current language of the media playing
QUESTION:QUERY,What’s the current song playing on the speaker
QUESTION:QUERY,What’s the current status of the washing machine
QUESTION:QUERY,What’s the current temperature in the house
QUESTION:QUERY,What’s the duration of the Spanish language lesson
QUESTION:QUERY,What’s the duration of this movie
QUESTION:QUERY,What’s the genre of this movie
QUESTION:QUERY,What’s the latest release in the action genre
QUESTION:QUERY,What’s the most recent update
QUESTION:QUERY,What’s the name of this album
QUESTION:QUERY,What’s the name of this podcast episode
QUESTION:QUERY,What’s the next episode about
QUESTION:QUERY,What’s the next track on the playlist
QUESTION:QUERY,What’s the rating of the show “Money Heist”
QUESTION:QUERY,What’s the recipe for chocolate cake
QUESTION:QUERY,What’s the release date for the next season of "Ozark"
QUESTION:QUERY,What’s the runtime of "Jumanji: Welcome to the Jungle"
QUESTION:QUERY,What’s the status of the security system
QUESTION:QUERY,What’s the title of the Japanese drama episode
QUESTION:QUERY,What’s the title of the current movie
QUESTION:QUERY,What’s the title of the current podcast episode
QUESTION:QUERY,What’s the title of the movie I’m watching
QUESTION:QUERY,What’s the title of this episode
QUESTION:QUERY,What’s the weather forecast for this weekend
QUESTION:QUERY,What’s the weather forecast for tomorrow
QUESTION:QUERY,When can I start training my puppy
QUESTION:QUERY,When can she come
QUESTION:QUERY,When can we meet
QUESTION:QUERY,When did Lisa Ann start her career
QUESTION:QUERY,When did Nicole Aniston start her career
QUESTION:QUERY,When did the event start
QUESTION:QUERY,When does the class start
QUESTION:QUERY,When does the new policy take effect
QUESTION:QUERY,When does the new system go live
QUESTION:QUERY,When does the sale end
QUESTION:QUERY,When does the training session start
QUESTION:QUERY,When does this movie end
QUESTION:QUERY,When is Christmas
QUESTION:QUERY,When is my flight departing
QUESTION:QUERY,When is my next appointment
QUESTION:QUERY,When is the deadline for submitting the report
QUESTION:QUERY,When is the deadline for the application
QUESTION:QUERY,When is the deadline for the project
QUESTION:QUERY,When is the last time the dog was walked
QUESTION:QUERY,When is the next alarm set for
QUESTION:QUERY,When is the next episode available
QUESTION:QUERY,When is the next episode of "The Tim Ferriss Show" coming out
QUESTION:QUERY,When is the next episode of The Witcher available
QUESTION:QUERY,When is the next episode of the French series airing
QUESTION:QUERY,When is the next heatwave expected
QUESTION:QUERY,When is the next holiday
QUESTION:QUERY,When is the next language update for the translator
QUESTION:QUERY,When is the next public holiday
QUESTION:QUERY,When is the next scheduled cleaning by the robot
QUESTION:QUERY,When is the next scheduled irrigation
QUESTION:QUERY,When is the next scheduled irrigation for the garden
QUESTION:QUERY,When is the next scheduled maintenance for the HVAC system
QUESTION:QUERY,When is the next software release
QUESTION:QUERY,When is the next train to Boston
QUESTION:QUERY,When is the next train to the city
QUESTION:QUERY,When is the next update for the German news channel
QUESTION:QUERY,When is the next vet appointment for my pet
QUESTION:QUERY,When is the sequel to "Dune" coming out
QUESTION:QUERY,When is your birthday
QUESTION:QUERY,When should I switch my dog to adult food
QUESTION:QUERY,When should I take my dog to the vet next
QUESTION:QUERY,When was "Casablanca" released
QUESTION:QUERY,When was the Declaration of Independence signed
QUESTION:QUERY,When was the last episode of "Freakonomics Radio" released
QUESTION:QUERY,When was the last time I took my dog to the vet
QUESTION:QUERY,When was this album released
QUESTION:QUERY,When was this audiobook released
QUESTION:QUERY,When will my package arrive
QUESTION:QUERY,When will the event commence
QUESTION:QUERY,When will the new policy be implemented
QUESTION:QUERY,When will the new system be implemented
QUESTION:QUERY,When will the new version be released
QUESTION:QUERY,When will the next episode air
QUESTION:QUERY,When will the next episode be available
QUESTION:QUERY,When will the next episode of the series be released
QUESTION:QUERY,When will the next software update be available
QUESTION:QUERY,When will the porch light turn off automatically
QUESTION:QUERY,When will the song be over
QUESTION:QUERY,When will the sun set today
QUESTION:QUERY,When will the system update be completed
QUESTION:QUERY,When will the washing machine finish its cycle
QUESTION:QUERY,Where are you going tomorrow
QUESTION:QUERY,Where can I access the annual report
QUESTION:QUERY,Where can I buy a new laptop
QUESTION:QUERY,Where can I buy organic vegetables
QUESTION:QUERY,Where can I find a good dentist
QUESTION:QUERY,Where can I find a good place to eat nearby
QUESTION:QUERY,Where can I find a good restaurant
QUESTION:QUERY,Where can I find a good restaurant nearby
QUESTION:QUERY,Where can I find episodes about technology in podcasts
QUESTION:QUERY,Where can I find guides on filtering explicit content
QUESTION:QUERY,Where can I find more about the career of Angela White
QUESTION:QUERY,Where can I find more information about the adult actress "Carmen Electra"
QUESTION:QUERY,Where can I find my purchase history
QUESTION:QUERY,Where can I find new music recommendations
QUESTION:QUERY,Where can I find recent interviews with Tori Black
QUESTION:QUERY,Where can I find reliable tech support
QUESTION:QUERY,Where can I find the "Science Vs" podcast
QUESTION:QUERY,Where can I find the English version of this audiobook
QUESTION:QUERY,Where can I find the album details
QUESTION:QUERY,Where can I find the documentary "The Social Dilemma"
QUESTION:QUERY,Where can I find the latest episode of my show
QUESTION:QUERY,Where can I find the meeting schedule
QUESTION:QUERY,Where can I find the nearest pharmacy
QUESTION:QUERY,Where can I find the season finale
QUESTION:QUERY,Where can I find the user manual
QUESTION:QUERY,Where can I find the user manual for my smart TV
QUESTION:QUERY,Where can I find the user manual for my smart light bulbs
QUESTION:QUERY,Where can I find the user manual for the smart fridge
QUESTION:QUERY,Where can I purchase a reliable laptop
QUESTION:QUERY,Where can I stream "Spider-Man: No Way Home"
QUESTION:QUERY,Where can I watch the new "Avatar" movie
QUESTION:QUERY,Where did they go
QUESTION:QUERY,Where did you put my keys
QUESTION:QUERY,Where do I find the project guidelines
QUESTION:QUERY,Where do I submit my application
QUESTION:QUERY,Where has he visited
QUESTION:QUERY,Where is Kendra Lust originally from
QUESTION:QUERY,Where is Vancouver
QUESTION:QUERY,Where is my cat’s favorite resting spot
QUESTION:QUERY,Where is my dog's leash
QUESTION:QUERY,Where is my nearest coffee shop
QUESTION:QUERY,Where is my next meeting scheduled
QUESTION:QUERY,Where is the closest grocery store
QUESTION:QUERY,Where is the nearest Wi-Fi hotspot
QUESTION:QUERY,Where is the nearest gas station
QUESTION:QUERY,Where is the nearest pharmacy
QUESTION:QUERY,Where is the nearest restaurant
QUESTION:QUERY,Where is the security camera feed
QUESTION:QUERY,Where is the user manual for the smart lock
QUESTION:QUERY,Where is your home district
QUESTION:QUERY,Where should I submit my final report
QUESTION:QUERY,Where should we submit the feedback forms
QUESTION:QUERY,Where was Brandi Love born
QUESTION:QUERY,Which actor stars in "The Godfather"
QUESTION:QUERY,Which app can help with budgeting
QUESTION:QUERY,Which app is using the most data
QUESTION:QUERY,Which app should I use for budgeting
QUESTION:QUERY,Which app should I use for video calls
QUESTION:QUERY,Which artist painted this mural
QUESTION:QUERY,Which book is recommended for learning Python
QUESTION:QUERY,Which channel is currently set on the TV
QUESTION:QUERY,Which criteria are used for selection
QUESTION:QUERY,Which device is using the most energy
QUESTION:QUERY,Which device is using the most power
QUESTION:QUERY,Which device needs a firmware update
QUESTION:QUERY,Which episode is currently playing in the French series
QUESTION:QUERY,Which file should I edit
QUESTION:QUERY,Which files need to be reviewed
QUESTION:QUERY,Which films is Brandi Love known for
QUESTION:QUERY,Which ingredients are needed for this recipe
QUESTION:QUERY,Which languages are supported by the language learning app
QUESTION:QUERY,Which languages are supported for text-to-speech
QUESTION:QUERY,Which method is the most efficient
QUESTION:QUERY,Which movies are playing tonight
QUESTION:QUERY,Which newspaper do you read
QUESTION:QUERY,Which playlist is currently active
QUESTION:QUERY,Which playlist is currently active in Portuguese
QUESTION:QUERY,Which playlist is currently playing
QUESTION:QUERY,Which playlist should I listen to
QUESTION:QUERY,Which porn actresses have new releases this month
QUESTION:QUERY,Which road leads to the city center
QUESTION:QUERY,Which smart devices are currently connected
QUESTION:QUERY,Which software is best for editing photos
QUESTION:QUERY,Which software is recommended for this task
QUESTION:QUERY,Which team won the championship last year
QUESTION:QUERY,Who are some acclaimed adult film actresses in recent years
QUESTION:QUERY,Who are some adult actresses who have won major industry awards
QUESTION:QUERY,Who are some award-winning actresses in the adult industry
QUESTION:QUERY,Who are some famous actresses in adult films
QUESTION:QUERY,Who are some iconic adult film stars from the early 2000s
QUESTION:QUERY,Who are some influential women in the adult film industry
QUESTION:QUERY,Who are some popular porn actresses
QUESTION:QUERY,Who are some prominent figures in the adult film industry today
QUESTION:QUERY,Who are some top-rated adult actresses of the year
QUESTION:QUERY,Who are some top-rated adult film actresses according to critics
QUESTION:QUERY,Who are the best-known actresses in the adult film business
QUESTION:QUERY,Who are the leading actresses in the adult film industry
QUESTION:QUERY,Who are the leading adult film actresses today
QUESTION:QUERY,Who are the main cast members of "Black Panther"
QUESTION:QUERY,Who are the most influential figures in the adult film industry
QUESTION:QUERY,Who are the most recognized names in the adult film industry
QUESTION:QUERY,Who are the most talked-about actresses in adult films
QUESTION:QUERY,Who are the rising stars in the adult film industry
QUESTION:QUERY,Who are the top adult actresses according to recent polls
QUESTION:QUERY,Who are the top adult film actresses according to awards
QUESTION:QUERY,Who are the top adult film actresses according to fan polls
QUESTION:QUERY,Who are they
QUESTION:QUERY,Who authored the latest research paper
QUESTION:QUERY,Who authorized these changes
QUESTION:QUERY,Who can I contact for a service request
QUESTION:QUERY,Who can cook well
QUESTION:QUERY,Who composed the Four Seasons
QUESTION:QUERY,Who composed the music for the film "The Lion King"
QUESTION:QUERY,Who did she call
QUESTION:QUERY,Who discovered America
QUESTION:QUERY,Who discovered gravity
QUESTION:QUERY,Who discovered penicillin
QUESTION:QUERY,Who does John like
QUESTION:QUERY,Who has been recognized for excellence in adult film acting
QUESTION:QUERY,Who has been recognized for outstanding performances in adult films
QUESTION:QUERY,Who has had a significant career in adult films
QUESTION:QUERY,Who has made a notable impact in the adult film industry recently
QUESTION:QUERY,Who has made a significant impact in adult film acting
QUESTION:QUERY,Who has received the most accolades in adult entertainment
QUESTION:QUERY,Who has won awards in the adult film industry
QUESTION:QUERY,Who has won awards in the adult industry recently
QUESTION:QUERY,Who hosts "The Joe Rogan Experience"
QUESTION:QUERY,Who invented the airplane
QUESTION:QUERY,Who invented the light bulb
QUESTION:QUERY,Who invented the telephone
QUESTION:QUERY,Who is Angela White and what is she known for
QUESTION:QUERY,Who is a famous actress in the adult industry from the 90s
QUESTION:QUERY,Who is calling me right now
QUESTION:QUERY,Who is coming
QUESTION:QUERY,Who is considered a legend in the adult film industry
QUESTION:QUERY,Who is considered the best porn actress in the industry
QUESTION:QUERY,Who is currently at the front door
QUESTION:QUERY,Who is currently connected to the Wi-Fi network
QUESTION:QUERY,Who is currently logged into the security camera system
QUESTION:QUERY,Who is currently trending in adult entertainment
QUESTION:QUERY,Who is in charge of the marketing team
QUESTION:QUERY,Who is in charge of the tech support
QUESTION:QUERY,Who is known as the father of modern chemistry
QUESTION:QUERY,Who is known as the father of modern economics
QUESTION:QUERY,Who is known as the father of modern medicine
QUESTION:QUERY,Who is known as the father of modern physics
QUESTION:QUERY,Who is known for developing the theory of evolution
QUESTION:QUERY,Who is known for their work in adult films and has won awards
QUESTION:QUERY,Who is leading the new initiative
QUESTION:QUERY,Who is my next appointment with
QUESTION:QUERY,Who is recognized for their contributions to the adult film industry
QUESTION:QUERY,Who is responsible for the maintenance
QUESTION:QUERY,Who is responsible for this error
QUESTION:QUERY,Who is she
QUESTION:QUERY,Who is sleeping
QUESTION:QUERY,Who is the CEO of the company
QUESTION:QUERY,Who is the Greek god of the sea
QUESTION:QUERY,Who is the artist of this song
QUESTION:QUERY,Who is the artist of this track
QUESTION:QUERY,Who is the author of "1984"
QUESTION:QUERY,Who is the author of "Jane Eyre"
QUESTION:QUERY,Who is the author of "The Great Gatsby"
QUESTION:QUERY,Who is the author of "The Hobbit"
QUESTION:QUERY,Who is the author of this audiobook
QUESTION:QUERY,Who is the author of this book
QUESTION:QUERY,Who is the best veterinarian nearby
QUESTION:QUERY,Who is the contact for IT support
QUESTION:QUERY,Who is the current Secretary-General of the United Nations
QUESTION:QUERY,Who is the director of "Interstellar"
