tag,sentence
SENTENCE:EXCLAMATION,How convenient that feature is
SENTENCE:EXCLAMATION,How convenient this smart home system is
SENTENCE:EXCLAMATION,How convenient to schedule pet appointments from my phone
SENTENCE:EXCLAMATION,How cool is that car
SENTENCE:EXCLAMATION,How cool is that voice command
SENTENCE:EXCLAMATION,How cool this new episode is
SENTENCE:EXCLAMATION,How cute is that puppy
SENTENCE:EXCLAMATION,How cute it is to see your dog fetch the ball
SENTENCE:EXCLAMATION,How dazzling is that performance
SENTENCE:EXCLAMATION,How delicious does this food smell
SENTENCE:EXCLAMATION,How delightful this holiday season feels
SENTENCE:EXCLAMATION,How delightful this is
SENTENCE:EXCLAMATION,How easy it is to monitor the house with smart devices
SENTENCE:EXCLAMATION,How easy it is to set up content filters!
SENTENCE:EXCLAMATION,How effective these parental controls are!
SENTENCE:EXCLAMATION,How efficient this smart thermostat is
SENTENCE:EXCLAMATION,How efficient this system is
SENTENCE:EXCLAMATION,How engaging the "Freakonomics Radio" episode was
SENTENCE:EXCLAMATION,How engaging this German audiobook is!
SENTENCE:EXCLAMATION,How engaging this audiobook has been!
SENTENCE:EXCLAMATION,How enjoyable this Spanish film is with subtitles
SENTENCE:EXCLAMATION,How entertaining is that show
SENTENCE:EXCLAMATION,How entertaining that "Joe Rogan Experience" episode was
SENTENCE:EXCLAMATION,How entertaining “Bridgerton” is!
SENTENCE:EXCLAMATION,How exceptional this new invention is
SENTENCE:EXCLAMATION,How exciting is that game
SENTENCE:EXCLAMATION,How exciting is this adventure
SENTENCE:EXCLAMATION,How exciting is this news
SENTENCE:EXCLAMATION,How exciting the Japanese movie is
SENTENCE:EXCLAMATION,How exciting the latest episode of "The Daily" was
SENTENCE:EXCLAMATION,How exciting the new release featuring Riley Reid is
SENTENCE:EXCLAMATION,How exciting this concert recording is
SENTENCE:EXCLAMATION,How exciting this news is
SENTENCE:EXCLAMATION,How extraordinary is that event
SENTENCE:EXCLAMATION,How extraordinary is this performance
SENTENCE:EXCLAMATION,How fantastic is this book
SENTENCE:EXCLAMATION,How fantastic it is to have voice-enabled translations
SENTENCE:EXCLAMATION,How fantastic this event turned out
SENTENCE:EXCLAMATION,How fantastic this new app performs
SENTENCE:EXCLAMATION,How fantastic this show is
SENTENCE:EXCLAMATION,How fantastic this technology is
SENTENCE:EXCLAMATION,How fantastic this track is
SENTENCE:EXCLAMATION,How fascinating
SENTENCE:EXCLAMATION,How fascinating is that book
SENTENCE:EXCLAMATION,How fascinating the Korean lecture is!
SENTENCE:EXCLAMATION,How fascinating this German podcast is
SENTENCE:EXCLAMATION,How fascinating this ancient artifact is
SENTENCE:EXCLAMATION,How funny is that joke
SENTENCE:EXCLAMATION,How gorgeous is that dress
SENTENCE:EXCLAMATION,How great it is to binge-watch an entire series
SENTENCE:EXCLAMATION,How great it is to monitor my pet’s activity remotely
SENTENCE:EXCLAMATION,How great this album is
SENTENCE:EXCLAMATION,How great this app performs
SENTENCE:EXCLAMATION,How great this song sounds
SENTENCE:EXCLAMATION,How happy my rabbit looks with its new toy
SENTENCE:EXCLAMATION,How helpful this tool is
SENTENCE:EXCLAMATION,How immersive the audiobook is!
SENTENCE:EXCLAMATION,How immersive the audiobook's world is!
SENTENCE:EXCLAMATION,How impressive Tori Black’s new content is
SENTENCE:EXCLAMATION,How impressive is that building
SENTENCE:EXCLAMATION,How impressive is that performance
SENTENCE:EXCLAMATION,How impressive is this design
SENTENCE:EXCLAMATION,How impressive is this development
SENTENCE:EXCLAMATION,How impressive is this smart home system
SENTENCE:EXCLAMATION,How impressive it is to have the assistant speak multiple languages
SENTENCE:EXCLAMATION,How impressive it is to translate languages instantly
SENTENCE:EXCLAMATION,How impressive that the system detects movement
SENTENCE:EXCLAMATION,How impressive the automation works
SENTENCE:EXCLAMATION,How impressive the new park's design is
SENTENCE:EXCLAMATION,How impressive the security system is
SENTENCE:EXCLAMATION,How impressive this historical landmark is
SENTENCE:EXCLAMATION,How impressive this new Netflix series is
SENTENCE:EXCLAMATION,How impressive this playlist is
SENTENCE:EXCLAMATION,How impressive this smart lock works
SENTENCE:EXCLAMATION,How incredible Angela White’s latest video is
SENTENCE:EXCLAMATION,How incredible is that achievement
SENTENCE:EXCLAMATION,How incredible is that performance
SENTENCE:EXCLAMATION,How incredible is this artwork
SENTENCE:EXCLAMATION,How incredible is this experience
SENTENCE:EXCLAMATION,How incredible is this movie’s soundtrack
SENTENCE:EXCLAMATION,How incredible is this view
SENTENCE:EXCLAMATION,How incredible it is to control devices from anywhere
SENTENCE:EXCLAMATION,How incredible it is to switch languages effortlessly
SENTENCE:EXCLAMATION,How incredible that sunset looks
SENTENCE:EXCLAMATION,How incredible the home automation is
SENTENCE:EXCLAMATION,How incredible the new media player functions are
SENTENCE:EXCLAMATION,How incredible the performance is
SENTENCE:EXCLAMATION,How incredible the visual effects are in this film!
SENTENCE:EXCLAMATION,How incredible this album sounds
SENTENCE:EXCLAMATION,How incredible this audiobook’s storyline is!
SENTENCE:EXCLAMATION,How incredible this discovery is
SENTENCE:EXCLAMATION,How incredible this movie is
SENTENCE:EXCLAMATION,How incredible this technology is
SENTENCE:EXCLAMATION,How incredible this tool is
SENTENCE:EXCLAMATION,How innovative this design is
SENTENCE:EXCLAMATION,How insightful "The Tim Ferriss Show" has been lately
SENTENCE:EXCLAMATION,How insightful this "TED Talks" episode turned out to be
SENTENCE:EXCLAMATION,How intense the action scenes are!
SENTENCE:EXCLAMATION,How interesting this "True Crime Garage" episode turned out to be
SENTENCE:EXCLAMATION,How intriguing the latest season of “The Witcher” is!
SENTENCE:EXCLAMATION,How intriguing this "Science Vs" episode is
SENTENCE:EXCLAMATION,How lovely is that flower
SENTENCE:EXCLAMATION,How lovely the weather is this weekend
SENTENCE:EXCLAMATION,How magnificent is that building
SENTENCE:EXCLAMATION,How magnificent this historical building looks
SENTENCE:EXCLAMATION,How marvelous is that painting
SENTENCE:EXCLAMATION,How marvelous this new technology is
SENTENCE:EXCLAMATION,How marvelous this technology is for healthcare
SENTENCE:EXCLAMATION,How mesmerizing is the night sky
SENTENCE:EXCLAMATION,How mesmerizing that fireworks display was
SENTENCE:EXCLAMATION,How neat is that new update
SENTENCE:EXCLAMATION,How outstanding this event was
SENTENCE:EXCLAMATION,How powerful these content filters can be!
SENTENCE:EXCLAMATION,How refreshing is that drink
SENTENCE:EXCLAMATION,How refreshing the cool breeze is
SENTENCE:EXCLAMATION,How relaxing is that massage
SENTENCE:EXCLAMATION,How relaxing this music sounds
SENTENCE:EXCLAMATION,How remarkable this function is
SENTENCE:EXCLAMATION,How remarkable your dedication has been
SENTENCE:EXCLAMATION,How sleek this design looks
SENTENCE:EXCLAMATION,How smart your dog looks with that new trick
SENTENCE:EXCLAMATION,How splendid the garden appears in bloom
SENTENCE:EXCLAMATION,How splendid this garden looks in spring
SENTENCE:EXCLAMATION,How splendid this looks
SENTENCE:EXCLAMATION,How splendid this new design is
SENTENCE:EXCLAMATION,How splendidly this was executed
SENTENCE:EXCLAMATION,How splendidly you performed
SENTENCE:EXCLAMATION,How stunning is that dress
SENTENCE:EXCLAMATION,How stunning is that new feature
SENTENCE:EXCLAMATION,How stunning is that outfit
SENTENCE:EXCLAMATION,How stunning is that sunset
SENTENCE:EXCLAMATION,How stunning is that view
SENTENCE:EXCLAMATION,How stunning is this artwork
SENTENCE:EXCLAMATION,How stunning is this view
SENTENCE:EXCLAMATION,How stunning the view from here is
SENTENCE:EXCLAMATION,How stunning this smart thermostat is
SENTENCE:EXCLAMATION,How stylish is that outfit
SENTENCE:EXCLAMATION,How suspenseful the build-up was!
SENTENCE:EXCLAMATION,How tasty is that dish
SENTENCE:EXCLAMATION,How thrilling is this game
SENTENCE:EXCLAMATION,How thrilling the latest Netflix movie is
SENTENCE:EXCLAMATION,How thrilling this documentary is
SENTENCE:EXCLAMATION,How thrilling this episode turned out to be
SENTENCE:EXCLAMATION,How thrilling this game is
SENTENCE:EXCLAMATION,How thrilling this movie is!
SENTENCE:EXCLAMATION,How thrilling this rollercoaster ride was
SENTENCE:EXCLAMATION,How thrilling this video is
SENTENCE:EXCLAMATION,How thrilling “Money Heist” turned out to be!
SENTENCE:EXCLAMATION,How unique this design is
SENTENCE:EXCLAMATION,How useful it is to have multi-language support
SENTENCE:EXCLAMATION,How useful this function is
SENTENCE:EXCLAMATION,How warm it is outside today
SENTENCE:EXCLAMATION,How well the narrator performs!
SENTENCE:EXCLAMATION,How well this safe search feature works!
SENTENCE:EXCLAMATION,How well-behaved your dog is
SENTENCE:EXCLAMATION,How wonderful is that
SENTENCE:EXCLAMATION,How wonderful is that song
SENTENCE:EXCLAMATION,How wonderful it is to automate household chores
SENTENCE:EXCLAMATION,How wonderful it is to be here
SENTENCE:EXCLAMATION,How wonderful it is to have a smart thermostat
SENTENCE:EXCLAMATION,How wonderful that is
SENTENCE:EXCLAMATION,How wonderful this audiobook’s pacing is!
SENTENCE:EXCLAMATION,How wonderful this day has been
SENTENCE:EXCLAMATION,How wonderful this smart thermostat is
SENTENCE:EXCLAMATION,How wonderful to have a smart feeder that tracks my pet’s meals
SENTENCE:EXCLAMATION,It’s fascinating to see Nicole Aniston’s evolution in the industry
SENTENCE:EXCLAMATION,It’s impressive how much Lisa Ann has accomplished
SENTENCE:EXCLAMATION,Jenna Jameson’s impact on the industry is undeniable
SENTENCE:EXCLAMATION,That's a great accomplishment
SENTENCE:EXCLAMATION,That's a groundbreaking achievement
SENTENCE:EXCLAMATION,That's a remarkable piece of craftsmanship
SENTENCE:EXCLAMATION,That's a truly remarkable achievement
SENTENCE:EXCLAMATION,That's absolutely astounding
SENTENCE:EXCLAMATION,That's absolutely brilliant
SENTENCE:EXCLAMATION,That's absolutely spectacular
SENTENCE:EXCLAMATION,That's amazing
SENTENCE:EXCLAMATION,That's amazing news
SENTENCE:EXCLAMATION,That's an absolutely stunning photograph
SENTENCE:EXCLAMATION,That's an amazing idea
SENTENCE:EXCLAMATION,That's an amazing offer
SENTENCE:EXCLAMATION,That's an amazing update
SENTENCE:EXCLAMATION,That's an amazing way to manage energy usage
SENTENCE:EXCLAMATION,That's an astonishing breakthrough in science
SENTENCE:EXCLAMATION,That's an astonishing result
SENTENCE:EXCLAMATION,That's an exceptional performance
SENTENCE:EXCLAMATION,That's an incredible story
SENTENCE:EXCLAMATION,That's an outstanding achievement
SENTENCE:EXCLAMATION,That's exceptionally wonderful
SENTENCE:EXCLAMATION,That's extraordinarily innovative
SENTENCE:EXCLAMATION,That's extraordinarily useful
SENTENCE:EXCLAMATION,That's fantastic
SENTENCE:EXCLAMATION,That's fantastic news
SENTENCE:EXCLAMATION,That's incredible
SENTENCE:EXCLAMATION,That's incredible news
SENTENCE:EXCLAMATION,That's incredibly useful
SENTENCE:EXCLAMATION,That's remarkably impressive
SENTENCE:EXCLAMATION,That's unbelievably creative
SENTENCE:EXCLAMATION,That's unbelievably fantastic
SENTENCE:EXCLAMATION,That’s a smart way to manage energy usage
SENTENCE:EXCLAMATION,That’s exceptionally well done
SENTENCE:EXCLAMATION,That’s incredibly helpful
SENTENCE:EXCLAMATION,That’s truly remarkable
SENTENCE:EXCLAMATION,This is a dream come true
SENTENCE:EXCLAMATION,This is amazing news
SENTENCE:EXCLAMATION,This is fantastic
SENTENCE:EXCLAMATION,This is incredible news
SENTENCE:EXCLAMATION,This is phenomenal news
SENTENCE:EXCLAMATION,This is the best day ever
SENTENCE:EXCLAMATION,This is the best news I've heard all day
SENTENCE:EXCLAMATION,This is the best news ever
SENTENCE:EXCLAMATION,This is the happiest I've felt in a long time
SENTENCE:EXCLAMATION,This is unbelievable
SENTENCE:EXCLAMATION,Tori Black’s performances are highly acclaimed
SENTENCE:EXCLAMATION,What a beautiful bird
SENTENCE:EXCLAMATION,What a beautiful day
SENTENCE:EXCLAMATION,What a beautiful day we’re having
SENTENCE:EXCLAMATION,What a beautiful melody
SENTENCE:EXCLAMATION,What a beautiful painting
SENTENCE:EXCLAMATION,What a beautiful performance
SENTENCE:EXCLAMATION,What a beautiful sunset
SENTENCE:EXCLAMATION,What a beautiful view
SENTENCE:EXCLAMATION,What a breathtaking performance by the lead actress!
SENTENCE:EXCLAMATION,What a breathtaking piece of art
SENTENCE:EXCLAMATION,What a breathtaking sight
SENTENCE:EXCLAMATION,What a breathtaking view
SENTENCE:EXCLAMATION,What a brilliant idea
SENTENCE:EXCLAMATION,What a brilliant idea to have a voice-controlled speaker
SENTENCE:EXCLAMATION,What a brilliant solution
SENTENCE:EXCLAMATION,What a captivating Chinese drama
SENTENCE:EXCLAMATION,What a captivating story
SENTENCE:EXCLAMATION,What a captivating storyline!
SENTENCE:EXCLAMATION,What a catchy song this is
SENTENCE:EXCLAMATION,What a charming little café this is
SENTENCE:EXCLAMATION,What a charming village
SENTENCE:EXCLAMATION,What a clever cat you have
SENTENCE:EXCLAMATION,What a clever idea that is
SENTENCE:EXCLAMATION,What a clever solution for home security
SENTENCE:EXCLAMATION,What a clever way to save energy with smart lighting
SENTENCE:EXCLAMATION,What a compelling story on "The Moth"
SENTENCE:EXCLAMATION,What a convenient feature this is
SENTENCE:EXCLAMATION,What a convenient function
SENTENCE:EXCLAMATION,What a convenient tool for learning new languages
SENTENCE:EXCLAMATION,What a convenient way to control my home
SENTENCE:EXCLAMATION,What a cool gadget
SENTENCE:EXCLAMATION,What a creative design
SENTENCE:EXCLAMATION,What a dazzling performance
SENTENCE:EXCLAMATION,What a dazzling performance by the dancers
SENTENCE:EXCLAMATION,What a delicious meal
SENTENCE:EXCLAMATION,What a delicious meal this is
SENTENCE:EXCLAMATION,What a delicious recipe
SENTENCE:EXCLAMATION,What a delightful evening
SENTENCE:EXCLAMATION,What a delightful surprise
SENTENCE:EXCLAMATION,What a delightful surprise this is
SENTENCE:EXCLAMATION,What a delightful surprise this party is
SENTENCE:EXCLAMATION,What a fantastic app this is
SENTENCE:EXCLAMATION,What a fantastic book this audiobook is!
SENTENCE:EXCLAMATION,What a fantastic book this is
SENTENCE:EXCLAMATION,What a fantastic choice of audiobooks!
SENTENCE:EXCLAMATION,What a fantastic collection of French audiobooks
SENTENCE:EXCLAMATION,What a fantastic day
SENTENCE:EXCLAMATION,What a fantastic demonstration
SENTENCE:EXCLAMATION,What a fantastic ending to the film!
SENTENCE:EXCLAMATION,What a fantastic episode of the podcast
SENTENCE:EXCLAMATION,What a fantastic feature
SENTENCE:EXCLAMATION,What a fantastic feature to adjust lights with voice
SENTENCE:EXCLAMATION,What a fantastic home theater setup
SENTENCE:EXCLAMATION,What a fantastic job you did on this project
SENTENCE:EXCLAMATION,What a fantastic movie
SENTENCE:EXCLAMATION,What a fantastic movie this is
SENTENCE:EXCLAMATION,What a fantastic movie “The Irishman” was!
SENTENCE:EXCLAMATION,What a fantastic new release on Netflix
SENTENCE:EXCLAMATION,What a fantastic new update
SENTENCE:EXCLAMATION,What a fantastic performance
SENTENCE:EXCLAMATION,What a fantastic performance by Mia Khalifa
SENTENCE:EXCLAMATION,What a fantastic sound system this is
SENTENCE:EXCLAMATION,What a fantastic view from the smart camera
SENTENCE:EXCLAMATION,What a fantastic way to automate home tasks
SENTENCE:EXCLAMATION,What a fantastic way to control online content!
SENTENCE:EXCLAMATION,What a fantastic weekend
SENTENCE:EXCLAMATION,What a fascinating episode of "Science Vs"
SENTENCE:EXCLAMATION,What a fascinating exhibit
SENTENCE:EXCLAMATION,What a fascinating place
SENTENCE:EXCLAMATION,What a fascinating podcast on true crime
SENTENCE:EXCLAMATION,What a fun evening we had
SENTENCE:EXCLAMATION,What a fun event this is
SENTENCE:EXCLAMATION,What a good boy your dog is
SENTENCE:EXCLAMATION,What a gorgeous dress
SENTENCE:EXCLAMATION,What a great addition to have speech recognition in various languages
SENTENCE:EXCLAMATION,What a great album this is
SENTENCE:EXCLAMATION,What a great choice for a gift
SENTENCE:EXCLAMATION,What a great discussion on "The Joe Rogan Experience"
SENTENCE:EXCLAMATION,What a great feature the security camera is
SENTENCE:EXCLAMATION,What a great feature to adjust subtitle languages
SENTENCE:EXCLAMATION,What a great feature to control the lights remotely
SENTENCE:EXCLAMATION,What a great feature to learn new languages
SENTENCE:EXCLAMATION,What a great feature to set the thermostat remotely
SENTENCE:EXCLAMATION,What a great interview on "Armchair Expert"
SENTENCE:EXCLAMATION,What a great interview with Sasha Grey
SENTENCE:EXCLAMATION,What a great job the robot vacuum does
SENTENCE:EXCLAMATION,What a great job you did
SENTENCE:EXCLAMATION,What a great movie scene
SENTENCE:EXCLAMATION,What a great performance
SENTENCE:EXCLAMATION,What a great performance by the team
SENTENCE:EXCLAMATION,What a great playlist I’m listening to
SENTENCE:EXCLAMATION,What a great recommendation “Ozark” turned out to be!
SENTENCE:EXCLAMATION,What a great reminder system
SENTENCE:EXCLAMATION,What a great song choice
SENTENCE:EXCLAMATION,What a great song this is
SENTENCE:EXCLAMATION,What a great tool for blocking explicit content!
SENTENCE:EXCLAMATION,What a great view from this spot
SENTENCE:EXCLAMATION,What a great way to practice pronunciation with the voice assistant
SENTENCE:EXCLAMATION,What a gripping audiobook this is!
SENTENCE:EXCLAMATION,What a gripping tale this audiobook tells!
SENTENCE:EXCLAMATION,What a helpful tool for language learners
SENTENCE:EXCLAMATION,What a huge improvement
SENTENCE:EXCLAMATION,What a joy it is to see my cat’s playful moments captured
SENTENCE:EXCLAMATION,What a joyful occasion this is
SENTENCE:EXCLAMATION,What a lovely day for a walk
SENTENCE:EXCLAMATION,What a lovely evening this is
SENTENCE:EXCLAMATION,What a lovely garden
SENTENCE:EXCLAMATION,What a lovely surprise
SENTENCE:EXCLAMATION,What a magical moment
SENTENCE:EXCLAMATION,What a marvelous design
SENTENCE:EXCLAMATION,What a marvelous idea
SENTENCE:EXCLAMATION,What a mesmerizing playlist
SENTENCE:EXCLAMATION,What a nice day for a walk
SENTENCE:EXCLAMATION,What a nice person you are
SENTENCE:EXCLAMATION,What a perfect day for a picnic
SENTENCE:EXCLAMATION,What a perfect evening for stargazing
SENTENCE:EXCLAMATION,What a perfect gift
SENTENCE:EXCLAMATION,What a phenomenal achievement
SENTENCE:EXCLAMATION,What a phenomenal concert
SENTENCE:EXCLAMATION,What a phenomenal effort from the team
SENTENCE:EXCLAMATION,What a playful dog you have
SENTENCE:EXCLAMATION,What a pleasant surprise
SENTENCE:EXCLAMATION,What a pleasant temperature it is
SENTENCE:EXCLAMATION,What a relaxing Portuguese music playlist
SENTENCE:EXCLAMATION,What a relief to have adult content blocked!
SENTENCE:EXCLAMATION,What a remarkable achievement
SENTENCE:EXCLAMATION,What a remarkable career Stormy Daniels has had
SENTENCE:EXCLAMATION,What a remarkable discovery
SENTENCE:EXCLAMATION,What a remarkable person
SENTENCE:EXCLAMATION,What a seamless way to manage home devices
SENTENCE:EXCLAMATION,What a sleek design for this smart speaker
SENTENCE:EXCLAMATION,What a smart parrot, it can talk!
SENTENCE:EXCLAMATION,What a smart way to enhance home security
SENTENCE:EXCLAMATION,What a smart way to manage home security systems
SENTENCE:EXCLAMATION,What a smart way to manage multilingual conversations
SENTENCE:EXCLAMATION,What a smooth music streaming experience
SENTENCE:EXCLAMATION,What a spectacular fireworks display
SENTENCE:EXCLAMATION,What a spectacular show
SENTENCE:EXCLAMATION,What a spectacular view from the top of the hill
SENTENCE:EXCLAMATION,What a splendid party
SENTENCE:EXCLAMATION,What a stunning dress you’re wearing
SENTENCE:EXCLAMATION,What a stunning music video
SENTENCE:EXCLAMATION,What a stunning performance
SENTENCE:EXCLAMATION,What a stunning piece of art
SENTENCE:EXCLAMATION,What a stunning piece of work
SENTENCE:EXCLAMATION,What a stunning sunset
SENTENCE:EXCLAMATION,What a stunning sunset over the ocean
SENTENCE:EXCLAMATION,What a stunning update on Jenna Jameson
SENTENCE:EXCLAMATION,What a stunning view
SENTENCE:EXCLAMATION,What a stunning view from here
SENTENCE:EXCLAMATION,What a stunning visual effect in this movie
SENTENCE:EXCLAMATION,What a stunning visual experience!
SENTENCE:EXCLAMATION,What a sunny day it is
SENTENCE:EXCLAMATION,What a thrilling audiobook experience!
SENTENCE:EXCLAMATION,What a thrilling climax to the story!
SENTENCE:EXCLAMATION,What a thrilling experience
SENTENCE:EXCLAMATION,What a thrilling experience this has been
SENTENCE:EXCLAMATION,What a thrilling ride
SENTENCE:EXCLAMATION,What a touching gesture
SENTENCE:EXCLAMATION,What a touching story
SENTENCE:EXCLAMATION,What a unique experience this is
SENTENCE:EXCLAMATION,What a useful feature for blocking adult websites!
SENTENCE:EXCLAMATION,What a useful feature to change language settings easily
SENTENCE:EXCLAMATION,What a useful feature to read text aloud
SENTENCE:EXCLAMATION,What a useful tool for learning multiple languages
SENTENCE:EXCLAMATION,What a well-trained dog you have
SENTENCE:EXCLAMATION,What a wonderful gift
SENTENCE:EXCLAMATION,What a wonderful interface
SENTENCE:EXCLAMATION,What a wonderful piece of art
SENTENCE:EXCLAMATION,What a wonderful sunrise this morning
SENTENCE:EXCLAMATION,What a wonderful surprise
SENTENCE:EXCLAMATION,What a wonderful surprise this is
SENTENCE:EXCLAMATION,What a wonderful video quality
SENTENCE:EXCLAMATION,What an advanced security system we have
SENTENCE:EXCLAMATION,What an amazing cast this film has!
SENTENCE:EXCLAMATION,What an amazing concert
SENTENCE:EXCLAMATION,What an amazing experience
SENTENCE:EXCLAMATION,What an amazing experience we had
SENTENCE:EXCLAMATION,What an amazing feature this is
SENTENCE:EXCLAMATION,What an amazing feature this smart home system has
SENTENCE:EXCLAMATION,What an amazing gift
SENTENCE:EXCLAMATION,What an amazing improvement
SENTENCE:EXCLAMATION,What an amazing show “The Crown” is!
SENTENCE:EXCLAMATION,What an amazing soundtrack this is
SENTENCE:EXCLAMATION,What an amazing sunset this is
SENTENCE:EXCLAMATION,What an amazing voice the narrator has!
SENTENCE:EXCLAMATION,What an awesome day
SENTENCE:EXCLAMATION,What an efficient system
SENTENCE:EXCLAMATION,What an enjoyable experience
SENTENCE:EXCLAMATION,What an enthralling audiobook experience!
SENTENCE:EXCLAMATION,What an excellent choice
SENTENCE:EXCLAMATION,What an excellent idea
SENTENCE:EXCLAMATION,What an excellent service
SENTENCE:EXCLAMATION,What an excellent upgrade to the home automation system
SENTENCE:EXCLAMATION,What an exciting development in the field
SENTENCE:EXCLAMATION,What an exciting game this is
SENTENCE:EXCLAMATION,What an exciting new show to watch
SENTENCE:EXCLAMATION,What an exciting plot twist
SENTENCE:EXCLAMATION,What an extraordinary concert performance
SENTENCE:EXCLAMATION,What an extraordinary performance
SENTENCE:EXCLAMATION,What an extraordinary piece of art
SENTENCE:EXCLAMATION,What an extraordinary place
SENTENCE:EXCLAMATION,What an impressive accomplishment
SENTENCE:EXCLAMATION,What an impressive achievement
SENTENCE:EXCLAMATION,What an impressive display
SENTENCE:EXCLAMATION,What an impressive display of skill
SENTENCE:EXCLAMATION,What an impressive display of skills
SENTENCE:EXCLAMATION,What an impressive performance by the dancers
SENTENCE:EXCLAMATION,What an impressive playlist
SENTENCE:EXCLAMATION,What an impressive system for home automation
SENTENCE:EXCLAMATION,What an impressive update
SENTENCE:EXCLAMATION,What an incredible day this has been
SENTENCE:EXCLAMATION,What an incredible feature
SENTENCE:EXCLAMATION,What an incredible interview on "Radiolab"
SENTENCE:EXCLAMATION,What an incredible journey we've had
SENTENCE:EXCLAMATION,What an incredible performance by the artist
SENTENCE:EXCLAMATION,What an incredible performance by the lead actor!
SENTENCE:EXCLAMATION,What an incredible performance by the orchestra
SENTENCE:EXCLAMATION,What an incredible performance this is
SENTENCE:EXCLAMATION,What an incredible podcast about personal development
SENTENCE:EXCLAMATION,What an incredible podcast episode
SENTENCE:EXCLAMATION,What an incredible story this audiobook tells!
SENTENCE:EXCLAMATION,What an incredible sunrise
SENTENCE:EXCLAMATION,What an incredible transformation
SENTENCE:EXCLAMATION,What an incredible view from here
SENTENCE:EXCLAMATION,What an incredible view from up here
SENTENCE:EXCLAMATION,What an innovative solution
SENTENCE:EXCLAMATION,What an insightful episode of "The Daily"
SENTENCE:EXCLAMATION,What an inspiring performance
SENTENCE:EXCLAMATION,What an inspiring story
SENTENCE:EXCLAMATION,What an intense action sequence that was!
SENTENCE:EXCLAMATION,What an interesting Spanish podcast episode!
SENTENCE:EXCLAMATION,What an interesting lecture
SENTENCE:EXCLAMATION,What an unforgettable experience
SENTENCE:EXCLAMATION,Wow, Sasha Grey has had a remarkable career
SENTENCE:EXCLAMATION,Wow, that's an impressive feature
SENTENCE:EXCLAMATION,Wow, the sound quality of this speaker is amazing!
SENTENCE:EXCLAMATION,Wow, this song is incredible
SENTENCE:EXCLAMATION,Wow, what an amazing performance
SENTENCE:EXCLAMATION,Wow, what an incredible performance
SENTENCE:SOCIAL,Appreciate you adjusting the accent
SENTENCE:SOCIAL,Appreciate you checking the pet's water bowl
SENTENCE:SOCIAL,Appreciate you setting the alarm
SENTENCE:SOCIAL,Appreciate you setting the alarm for me
SENTENCE:SOCIAL,Appreciate you setting the alarm system
SENTENCE:SOCIAL,Appreciate you setting the timer
SENTENCE:SOCIAL,Appreciate you setting up the voice responses in Mandarin
SENTENCE:SOCIAL,Appreciate you translating the document quickly
SENTENCE:SOCIAL,Appreciate you turning off the heater
SENTENCE:SOCIAL,Appreciate you turning on the outdoor lights
